{
  "$schema": "https://json-schema.org/draft/2020-12/schema",
  "$id": "https://mortal-os.com/schemas/s1-participant-core-receipt.schema.json",
  "title": "MortalOS S1 Participant Core evidence receipt",
  "type": "object",
  "additionalProperties": false,
  "required": [
    "format",
    "stage",
    "status",
    "source_commit",
    "base_commit",
    "dependency_lock_digest",
    "package_digests",
    "contracts",
    "commands",
    "environment",
    "seeds",
    "started_at",
    "completed_at",
    "results",
    "known_limitations",
    "failures",
    "artifact_digests",
    "review_snapshot"
  ],
  "properties": {
    "format": { "const": "mortalos-stage-receipt/1" },
    "stage": { "const": "S1" },
    "status": { "enum": ["PASS", "HOLD"] },
    "source_commit": { "$ref": "#/$defs/commit" },
    "base_commit": { "$ref": "#/$defs/commit" },
    "dependency_lock_digest": { "$ref": "#/$defs/digest" },
    "package_digests": {
      "type": "object",
      "additionalProperties": { "$ref": "#/$defs/digest" },
      "minProperties": 1
    },
    "contracts": {
      "type": "object",
      "additionalProperties": false,
      "required": ["operation", "snapshot", "port", "protocol", "state", "crypto"],
      "properties": {
        "operation": { "const": "mortalos-participant-operation/1" },
        "snapshot": { "const": "mortalos-participant-snapshot/1" },
        "port": { "const": "mortalos-participant-port/1" },
        "protocol": {
          "type": "array",
          "items": { "enum": ["mortalos/0", "mortalos/1"] },
          "minItems": 2,
          "maxItems": 2,
          "uniqueItems": true
        },
        "state": { "const": "mortalos-state/1" },
        "crypto": {
          "type": "array",
          "items": { "enum": ["Ed25519", "SHA-256"] },
          "minItems": 2,
          "maxItems": 2,
          "uniqueItems": true
        }
      }
    },
    "commands": {
      "type": "array",
      "minItems": 10,
      "maxItems": 10,
      "items": {
        "type": "object",
        "additionalProperties": false,
        "required": ["command", "status", "summary"],
        "properties": {
          "command": { "type": "string", "minLength": 1 },
          "status": { "const": "PASS" },
          "summary": { "type": "string", "minLength": 1 }
        }
      }
    },
    "environment": {
      "type": "object",
      "additionalProperties": false,
      "required": [
        "os",
        "architecture",
        "node",
        "npm",
        "chromium",
        "timezone",
        "cross_origin_isolated_lab"
      ],
      "properties": {
        "os": { "type": "string" },
        "architecture": { "type": "string" },
        "node": { "type": "string" },
        "npm": { "type": "string" },
        "chromium": { "type": "string" },
        "timezone": { "type": "string" },
        "cross_origin_isolated_lab": { "type": "boolean" }
      }
    },
    "seeds": {
      "type": "object",
      "additionalProperties": false,
      "required": ["participant_schedule_count", "participant_events_per_schedule", "property_corpus"],
      "properties": {
        "participant_schedule_count": { "const": 10000 },
        "participant_events_per_schedule": { "const": 12 },
        "property_corpus": { "const": 1297044052 }
      }
    },
    "started_at": { "$ref": "#/$defs/timestamp" },
    "completed_at": { "$ref": "#/$defs/timestamp" },
    "results": { "type": "object", "minProperties": 1 },
    "known_limitations": {
      "type": "array",
      "items": { "type": "string", "minLength": 1 },
      "minItems": 5,
      "maxItems": 5,
      "uniqueItems": true
    },
    "failures": { "type": "array", "maxItems": 0 },
    "artifact_digests": {
      "type": "object",
      "additionalProperties": { "$ref": "#/$defs/digest" },
      "minProperties": 24,
      "maxProperties": 24
    },
    "review_snapshot": { "type": "string", "minLength": 1 }
  },
  "$defs": {
    "commit": { "type": "string", "pattern": "^[0-9a-f]{40}$" },
    "digest": { "type": "string", "pattern": "^sha256:[0-9a-f]{64}$" },
    "timestamp": {
      "type": "string",
      "pattern": "^\\d{4}-\\d{2}-\\d{2}T\\d{2}:\\d{2}:\\d{2}(?:\\.\\d+)?Z$"
    }
  }
}
