{
  "format": "mortalos-stage-receipt/1",
  "stage": "S1",
  "status": "PASS",
  "source_commit": "1a0de4e750ebe0f4ec1f1f178e82563f14cf4e09",
  "base_commit": "4a3ede86402ba507c49fb5f563bf932fedd5eb1c",
  "dependency_lock_digest": "sha256:c69b887d03595e6f734849129fd73ab0f2898ec81f848b65463d1bf7ba4b9298",
  "package_digests": {
    "package.json": "sha256:e06bc497d039923d532a4f569529ccd7deb98ccf8bb44a64661cdfe1649f8d3b"
  },
  "contracts": {
    "operation": "mortalos-participant-operation/1",
    "snapshot": "mortalos-participant-snapshot/1",
    "port": "mortalos-participant-port/1",
    "protocol": [
      "mortalos/0",
      "mortalos/1"
    ],
    "state": "mortalos-state/1",
    "crypto": [
      "Ed25519",
      "SHA-256"
    ]
  },
  "commands": [
    {
      "command": "npm run test:participant-core",
      "status": "PASS",
      "summary": "Ten Participant Core, adapter, boundary, and model tests passed."
    },
    {
      "command": "npm run test:participant-core:coverage",
      "status": "PASS",
      "summary": "Participant Core coverage was 100.00% lines, 94.83% branches, and 100.00% functions."
    },
    {
      "command": "npm run verify:participant-core",
      "status": "PASS",
      "summary": "Two Node runs and Chromium produced byte-identical results for 10,000 schedules of 12 events."
    },
    {
      "command": "npm test",
      "status": "PASS",
      "summary": "The complete repository test chain passed from the beginning on the frozen source commit."
    },
    {
      "command": "npm run verify:lab",
      "status": "PASS",
      "summary": "Chromium Lab acceptance and 20 consecutive persistent A-to-B handoffs passed."
    },
    {
      "command": "npm run test:chromium",
      "status": "PASS",
      "summary": "Committed and Chromium corpus results were byte-identical; 10,000 adversarial cases were rejected."
    },
    {
      "command": "npm run verify:transport",
      "status": "PASS",
      "summary": "10,000 seeded schedules and 30,000 endpoint recoveries matched in Node and Chromium."
    },
    {
      "command": "npm run test:coverage",
      "status": "PASS",
      "summary": "Repository coverage was 94.70% lines, 92.31% branches, and 95.22% functions."
    },
    {
      "command": "npm audit --audit-level=moderate",
      "status": "PASS",
      "summary": "Found 0 vulnerabilities."
    },
    {
      "command": "npm run verify:s1",
      "status": "PASS",
      "summary": "Receipt schema, source lineage, exact changed-file inventory, digests, results, limitations, and bytes read back exactly."
    }
  ],
  "environment": {
    "os": "Windows",
    "architecture": "x64",
    "node": "v22.12.0",
    "npm": "10.9.0",
    "chromium": "149.0.7827.55",
    "timezone": "Asia/Seoul",
    "cross_origin_isolated_lab": true
  },
  "seeds": {
    "participant_schedule_count": 10000,
    "participant_events_per_schedule": 12,
    "property_corpus": 1297044052
  },
  "started_at": "2026-07-25T00:31:38.5986126Z",
  "completed_at": "2026-07-25T00:57:28.4493734Z",
  "results": {
    "participant_core_tests": {
      "passed": 10,
      "failed": 0
    },
    "participant_core_coverage_percent": {
      "lines": 100,
      "branches": 94.83,
      "functions": 100
    },
    "participant_model_parity": {
      "seeded_schedules": 10000,
      "events_per_schedule": 12,
      "exact_json_bytes": 8338152,
      "node_runs": 2,
      "chromium_runs": 1,
      "result_digest": "sha256:b440878b4a484bba5b38a3c4757d4d630793c4244facf88d9804ab033d3ed73a"
    },
    "stable_negative_outcomes": [
      "E_STATE_MISSING",
      "E_APPROVAL_INSUFFICIENT_QUORUM",
      "E_SIGNATURE_DUPLICATE",
      "E_LOCAL_EQUIVOCATION_REFUSED",
      "E_PARENT_STALE",
      "E_EVIDENCE_CORRUPT",
      "E_TRANSPORT_UNAVAILABLE"
    ],
    "behavior_matrix": {
      "single_browser": "PASS",
      "durable_reload": "PASS",
      "a_to_b_handoff": "PASS",
      "three_pair_loss_and_repair": "PASS",
      "out_of_order_catch_up": "PASS",
      "visible_fork": "PASS",
      "negative_handoff": "PASS"
    },
    "authority_boundary": {
      "candidate_construction_owner": "ParticipantCore",
      "recognized_head_owner": "ParticipantCore",
      "forbidden_adapter_import_test": "PASS",
      "adapter_acceptance_or_head_selection_branches": 0
    },
    "protocol_conformance": {
      "passed": 76,
      "failed": 0
    },
    "property_cases": {
      "accepted_or_rejected_as_expected": 10000,
      "failed": 0
    },
    "state_transitions": {
      "passed": 10000,
      "failed": 0
    },
    "isolated_chromium_quorum": {
      "fresh_runs": 10,
      "failed": 0
    },
    "persistent_handoffs": {
      "passed": 20,
      "total": 20,
      "relay_operations_per_12_seconds": 38,
      "local_rate_limit_failures": 0
    },
    "portable_adversarial_cases": {
      "rejected": 10000,
      "total": 10000
    },
    "transport": {
      "seeded_schedules": 10000,
      "endpoint_recoveries": 30000,
      "node_chromium_result_digest": "sha256:4dd66c9bf7d68af2c3e520987c1bccb3fcad8213a063178319eb7fcba9ab81d3"
    },
    "repository_coverage_percent": {
      "lines": 94.7,
      "branches": 92.31,
      "functions": 95.22
    },
    "dependency_vulnerabilities": {
      "moderate_or_higher": 0,
      "total": 0
    }
  },
  "known_limitations": [
    "Crash-safe prepare, commit, and recovery across a durable 2-of-3 quorum remain S2 work.",
    "R3 state-manifest, chunk replication, and repair remain S3 work.",
    "State confidentiality and encrypted recovery remain S4 work.",
    "Independent SDK, CLI, and Continuity Capsule surfaces remain S5 and S6 work.",
    "Independent physical and administrative failure domains plus Firefox and WebKit parity remain S7 and S8 work."
  ],
  "failures": [],
  "artifact_digests": {
    ".github/workflows/verify.yml": "sha256:8114d06163d85e77f644518b8c9fd8e5202e42827265b8915a075307d608474e",
    "agents/codex-protocol-kernel/HANDOFF.md": "sha256:3df7d6437ba9a70274781a2472ca24aff3437da115df25b04eb3d5a5d7d75740",
    "agents/codex-protocol-kernel/WORKLOG.md": "sha256:59b49aed9073053f0320e1d6d6324324003b884c86e59a6944af0ab676e23f14",
    "docs/CLAIM_MATRIX.md": "sha256:dec1835bf8a73240577be64221a9be97e1cdc4f4828896e2e20e477e37a8f61f",
    "docs/NORTH_STAR_ROADMAP.md": "sha256:c4d193ae71fe541471d3cba43a7546dcbfed1dc928b6bf0fbc1df946cb8a4298",
    "docs/PARTICIPANT_CORE.md": "sha256:a673266b8202e549451e0f6d12af945a3834c3bffde916d8212c92974ff723fb",
    "docs/POST_HACKATHON_NORTH_STAR_IMPLEMENTATION_PLAN.md": "sha256:7e4475dfd97d9cbe383913ed09ecd66acbd06996bd8033dc921bc6041722cf31",
    "docs/README.md": "sha256:11e0a038f708a3482c8f09d01cc6c0ff76d580a85f57742e7f958951ac6e8b3f",
    "docs/STAGE_TRACKING.md": "sha256:1e95a567b172631055a7fd67e80f1f579484a8b7e6f2e37b7fc9cf7f68df7cb0",
    "docs/THREAT_MODEL.md": "sha256:38d5053cbf7a3cab729ac292976eb3fc4b3d4092851a552b968b11b7388ea762",
    "docs/TRACEABILITY.md": "sha256:68bc39a0b5ffaa83f1715be9820a45e4a4df022f2eeb838d11f60daa3f86816c",
    "lab/live-incubator.mjs": "sha256:c813cfe5a98f6415ab8310f18c36a7db7c5100b499f5dde037b8575c57db988c",
    "lab/participant/contracts.mjs": "sha256:2346e0d6bcb32fc03b408b292aa463d963b78f2fff62dbda95be2a8a6ea6b6f1",
    "lab/participant/core.mjs": "sha256:d600b4b33d22fac4985818efefd853fb26cda4c0c70b8e82ce9392d2bf7389e0",
    "lab/participant/durable-participant.mjs": "sha256:0529db77d4530d10f18aff35bc8f286795ccbb9eac83c54d2f06a43c1c861ad4",
    "lab/participant/live-endpoint.mjs": "sha256:fef522db3f9d73c4fabc288a6272059fca7f0775b68d8b6bb52052bf74d05a04",
    "lab/participant/model.mjs": "sha256:30417f9c99c789bfe2a39c70762fc88cda49767838fa65e7ddd670e0210286fe",
    "lab/participant/protocol-objects.mjs": "sha256:f1632d338cc908b7e5d7f22ad63e2e84714e47849383387fad3af0d962cfe7ad",
    "lab/participant/quorum-endpoint.mjs": "sha256:c68507768d78b04d2807d7cbc597578c59cd23cc0441e00c887c8cfcd233c91a",
    "lab/participant/webcrypto-key-store.mjs": "sha256:2fb3b3f2bb88bc22db068e4b66f10004e388f0eff3fc9a2cedf56a359de1439b",
    "package.json": "sha256:e06bc497d039923d532a4f569529ccd7deb98ccf8bb44a64661cdfe1649f8d3b",
    "scripts/verify-participant-core.mjs": "sha256:a3168335c9e4142113367190a79d4d2deed276c7a53236011a6084c184afec32",
    "test/lab.test.mjs": "sha256:f8bd48d1bcee5c060f72bd711cf31009d6db3315e0e6f3d0d161d777b675d4fb",
    "test/participant-core.test.mjs": "sha256:8ed1a912f77cf17d964d982b1fc24f51cb13cf58236a60f82ac587a77d6bb6a2"
  },
  "review_snapshot": "pending: reviewer-merge-gate immutable-head review"
}
